<?xml version="1.0" encoding="UTF-8"?>
<!-- XML Sample Message of message hierarchy                                          -->
<!-- Message:             ADC INV Period Balance v1.0 Rev. 2                          -->
<!-- Transaction:         AA - Audit Data Collection Rev. 235                         -->
<!-- Datamodel:           Audit Data Collection Datamodel, version HEAD Rev. 312      -->
<!-- XML tagset used:     AdcsML                                                      -->
<!-- Generated at:        23-01-2021 19:19:03                                         -->
<!-- Generated using:     EC-Design 2.5.0 (http://www.ec-design.nl)                   -->
<!-- Generated by:        Jan Vrijenhoek (Digitect)                                   -->
<!-- Organisation:        Digitect B.V. (Digitect)                                    -->
<!-- NOTE:    This sample message was generated automatically: manual modifications will be lost -->
<AdcInvPeriodBalance xsi:schemaLocation="http://schemas.iso.org/AdcsML/Messages/AdcInvPeriodBalance-v1 AdcInvPeriodBalance-v1.0.xsd"
		xmlns="http://schemas.iso.org/AdcsML/Messages/AdcInvPeriodBalance-v1"
		xmlns:xsi="http://www.w3.org/2001/XMLSchema-instance">
	<InvPerBal>
		<InvPrdctId>PRD001</InvPrdctId>
		<LctId>L001</LctId>
		<FiscYr>2020</FiscYr>
		<AcntingPer>M1</AcntingPer>
		<InvOrgCd>BS001</InvOrgCd>
		<LotNr>LOT1</LotNr>
		<InvBegQt>100.0000</InvBegQt>
		<InvEndQt>100.0000</InvEndQt>
		<InvRcvdQt>100.0000</InvRcvdQt>
		<InvDispedQt>100.0000</InvDispedQt>
		<InvDbAmt>8000.0000</InvDbAmt>
		<InvCrAmt>8000.0000</InvCrAmt>
		<InvBegBal>8000.0000</InvBegBal>
		<InvEndBal>8000.0000</InvEndBal>
		<CostOrgCd>BS001</CostOrgCd>
		<InvStckUomCd>KG</InvStckUomCd>
		<InvCstngUomCd>KG</InvCstngUomCd>
		<BusSgX>BS001</BusSgX>
	</InvPerBal>
</AdcInvPeriodBalance>
